<?xml version="1.0" encoding="UTF-8"?>
<Order xmlns:xsi="http://www.w3.org/2016/XMLSchema-instance" xsi:noNamespaceSchemaLocation="./order.xsd">
    <OrderUniqueID>001</OrderUniqueID>
    <OrderTitle>"E-ark DIP order no 001"</OrderTitle>
    <UnitOfDescription xsi:type="anyType"/>
    <OrderOrigin>Email</OrderOrigin>
    <EndUserOrderNotes>"Thor Dekov Buur"</EndUserOrderNotes>
    <ArchivistOrderNotes>"End user is developer at Magenta ApS"</ArchivistOrderNotes>
    <OrderDate>2016-02-01T12:00:00</OrderDate>
    <OrderUserDossier>OrderUserDossier</OrderUserDossier>
    <ValidationDate>2016-02-01T12:00:00</ValidationDate>
    <PlannedDate>2016-02-02T12:00:00</PlannedDate>
    <AccessDate>2016-02-04T12:00:00</AccessDate>
    <AccessDateComments>"No later than 15th Feb."</AccessDateComments>
    <EndUserReference>"End user 001"</EndUserReference>
    <ResponsiblePerson>"Head Archivist"</ResponsiblePerson>
    <OrderStatus>2</OrderStatus>
    <AccessRestriction>
        <AccessRestrictionCode>0</AccessRestrictionCode>
        <AccessRestrictionTextExplanation>"No restrictions"</AccessRestrictionTextExplanation>
    </AccessRestriction>
    <InternalNote>
        <NoteText>"Please note that..."</NoteText>
        <Timestamp>2016-02-01T12:00:00</Timestamp>
    </InternalNote>
    <AccessEndDate>2016-04-04T12:00:00</AccessEndDate>
    <DeliveryFormat>"Fileshare"</DeliveryFormat>
</Order>
